{
  "$schema": "http://json-schema.org/draft-07/schema#",
  "$id": "github.com/gardener/landscaper/landscaper-service/definitions/shoot-configuration",
  "title": "Landscaper Configuration",
  "description": "Describes the configuration for the shoot cluster deployment.",
  "type": "object",
  "properties": {
    "provider": {
      "$ref": "#definitions/providerConfig"
    },
    "workers": {
      "$ref": "#definitions/workersConfig"
    },
    "region": {
      "type": "string"
    },
    "kubernetes": {
      "$ref": "#definitions/kubernetesConfig"
    },
    "maintenance": {
      "$ref": "#definition/maintenanceConfig"
    }
  },
  "definitions": {
    "providerConfig": {
      "properties": {
        "type": {
          "type": "string",
          "enum": ["gcp"]
        },
        "zone": {
          "type": "string"
        }
      }
    },
    "workersConfig": {
      "properties": {
        "machine": {
          "type": "object",
          "properties": {
            "type": {
              "type": "string"
            },
            "image": {
              "type": "object",
              "properties": {
                "name": {
                  "type": "string"
                },
                "version": {
                  "type": "string"
                }
              }
            }
          }
        },
        "minimum": {
          "type": "integer",
          "format": "int32"
        },
        "maximum": {
          "type": "integer",
          "format": "int32"
        },
        "maxSurge": {
          "type": "integer",
          "format": "int32"
        },
        "maxUnavailable": {
          "type": "integer",
          "format": "int32"
        },
        "volume": {
          "type": "object",
          "properties": {
            "type": {
              "type": "string"
            },
            "size": {
              "type": "string"
            }
          }
        }
      }
    },
    "kubernetesConfig": {
      "properties": {
        "version": {
          "type": "string"
        }
      }
    },
    "maintenanceConfig": {
      "properties": {
        "autoUpdate": {
          "type": "object",
          "properties": {
            "kubernetesVersion": {
              "type": "boolean"
            },
            "machineImageVersion": {
              "type": "boolean"
            }
          }
        },
        "timeWindow": {
          "type": "object",
          "properties": {
            "begin": {
              "type": "string"
            },
            "end": {
              "type": "string"
            }
          }
        }
      }
    }
  }
}