{
  "provider": {
    "type": "gcp",
    "zone": "europe-west1-c"
  },
  "region": "europe-west1",
  "workers": {
    "machine": {
      "type": "n1-standard-2",
      "image": {
        "name": "gardenlinux",
        "version": "576.12.0"
      }
    },
    "volume": {
      "type": "pd-standard",
      "size": "50Gi"
    },
    "minimum": 1,
    "maximum": 1,
    "maxSurge": 1,
    "maxUnavailable": 0
  },
  "kubernetes": {
    "version": "1.25"
  },
  "maintenance": {
    "timeWindow": {
      "begin": "050000+0200",
      "end": "060000+0200"
    },
    "autoUpdate": {
      "kubernetesVersion": false,
      "machineImageVersion": false
    }
  }
}
